,content
0,필리핀 등 외국인 가사근로자 100명 서울 맞벌이 가정서 일한다
1,방탄소년단 정국 레시피 업데이트🍜
2,하.. 7년 사귄 여친 바람폈다
3,애교 많은 푸바오 사촌 🐼 누안누안. gif (말레이시아 태생)
4,쿠우쿠우 파산시키고 왔다는 디씨인.jpg
5,"타블로 ""딸 하루, 아이돌 너무 좋아해…K팝 앨범 사느라 망하기 직전"""
6,강아지가 7일동안 물 안마셨길래 홈캠 설치하니깐...
7,여자 기숙사 개노답 3형제.jpg
8,푸히히 소리낼 것 같은 웃상 푸바오🐼
9,[단독]태백 거대 구렁이 목격자 더 있다...크기에 ‘경악’   (사진주의)
10,"[단독] ""안성일 직원이 따라 다녔다""…손승연, 거짓해명의 증거"
11,전 주호민 씨와 거의 같은 상황을 본적이 있습니다.
12,월급 세후 200 받으면
13,"현재 인기 급상승 동영상 1위 (쓰는 사이 1,2위 바뀜;;)"
14,재출시로기대모았지만 반응이별로였던과자.jpg
15,공부를 어떻게 하는 것이 효율적인가?라는 질문에 답하기에 좋은 리뷰.twt
16,원덬이가 -8kg 효과본 땅끄부부 루틴
17,“국내서 호구 당하느니 해외간다” 국내 여행 관심도 ‘하락’
18,오늘자 미국으로 출국하는 뉴진스.jpg
19,출국하는 방탄소년단 알엠
20,일본 트위터에서 불타고 있는 바비와 오펜하이머 불매운동
21,"SM 新보이그룹 라이즈(RIIZE), 내일(1일) 7인 전원 공개"
22,iOS용 트위터는 앱스토어에 'X'로 등록 불가능함
23,"한국인 313만 명 日 갈 때, 일본인은 고작 86만 명 왔다"
24,"[전문] '장필순 반려견 사망' 업주, 2차입장 ""연예인 영향력 이용해 두려웠다"""
25,장항준이 90년대에 인터뷰 하면서 개그치는 영상인데 시민분 얼굴 밖에 안보임...twt
26,그냥 이름만 가져온 거였던 재출시된 하몬스..
27,전현무만 이해한 파비앙 어휘력 ㄷㄷ....jpg
28,"방탄소년단 정국 위버스 라이브 ""누구야 빨리 나와"""
29,할미드립이 싫은 이유. jpg
30,"영화 <밀수> 무인에서 재수생이 영화 보러 왔다고 하자 염정아, 김혜수 반응.twt"
31,"녹은 시베리아 영구동토층에서 “46,000년 전에 얼어죽은 줄 알았던 벌레가 되살아나 번식 활동”"
32,나는 과연 친구의 전화에 어떻게 답변할 것인가? (mbti랑 답 말해보기)
33,하루에 100만원씩 줄테니 외출금지면
34,네이버페이 40원+1원 추가
35,aespa 에스파 ‘Better Things’ ➫ 2023.08.18 0AM (KST) / 0AM (PDT) / 0AM (EST)
36,"트와이스 (TWICE) 지효 미니 1집 ""ZONE"" 트랙리스트"
37,맛집 웨이팅 왜 기다려? vs 가치가 있어!
38,한국인들만 이해 못하는 개념
39,조회수 난리난 방탄소년단 정국 앵콜 영상
40,방탄소년단 정국 위버스 업뎃 (ㅇ...우리 아미들)
41,할미덬들은 기억할만한 문구점가면 공짜로 줬던것ㅋㅋㅋㅋㅋ.jpg
42,오늘 신박했던 뉴진스 음방 아이폰 엔딩
43,보고 있으면 마음이 몽글몽글해지는 푸바오(가족) 팬아트.jpg
44,오늘은 이모바오 킹콩바비 페이윈의 생일🎉🎉
45,모텔 신분증 검사에 개빡친 40대
46,같이 영화보기로 한 친구가 도착하지 않았을때 나는?
47,핫게간 더보이즈 자컨 발언의 진실
48,“비자 나오면 도망”…노총각 국제결혼 실태
49,"여성의 X염색체(엄마)가 남자아이(아들)의 자폐, 정신질환을 유발하는 증후군: 취약X증후군"
50,조규성 리그 2호골
51,일본에서 하고 있는 신선하고 새로운 배달 서비스.jpg
52,요즘 세븐틴 에스쿱스 팬들이 분열 중인 이유
53,대도서관- 윰댕 합의이혼.jpg
54,눈물나는 키크니 인스타.jpg
55,[KBO] 헤드샷 맞은 SSG 에레디아
56,대도서관 윰댕 이혼
57,"NCT 마크, 지성 Booty Wurk 챌린지"
58,나는솔로 돌싱특집근황
59,오늘자 ㄹㅇ 핫바디인 워터밤 태민.....avi
60,올해 최고의 호러 영화 (거의) 확정인 듯한 호주 영화
61,"진짜 뒤에 키가 저러고 있는데, 어케 창민 저러고 상 받은거임?.jpg"
62,논에 농약 치는 샤이니 태민.twt
63,왕가탕후루 강남역점 월급
64,바비후기 : 이 영화를 단순히 탈코르셋으로 해석하면 필패한다(스포일러)
65,실시간 물 쪼옵쪼옵 잘 빠는 상암 경기장
66,자폐아동 비율이 점점 늘고있다...국내는 38명 당 1명 꼴
67,[복면가왕] 공개 직전까지 민국이 정체 꽁꽁 숨긴 제작진들ㅋㅋㅋㅋㅋ
68,홀란드랑 손잡은 엄지윤ㅋㅋㅋㅋㅋㅋㅋㅋ
69,김성주 아들 김민국 근황
70,[앵콜캠4K] 정국 'Seven (feat. Latto)' 인기가요 1위 앵콜 직캠
71,오늘 뿌빠티비에서 공개된 진짜 푸바오에 진심이였던 보아 모습.JPG
72,흙수저 갤러리 래전드...... 엄마 프사......jpg
73,생각보다 많은 사람들이 모르는 지구온난화의 큰 원인 중 하나
74,위근우 인스타그램 - 주호민 그리고 침착맨
75,추억의 문방구 방향제.jpg
76,"달방보고 입덕, 오늘 인기가요 보러 온 방탄소년단 정국 남성팬"
77,윤성빈이 치팅데이에 하루종일 먹은거&먹고 난 후 몸무게.jpg
78,오늘자 올림픽 대로 2중 추돌 사고.jpg
79,500만원 아끼는 프랑스여행 꿀팁
80,신곡의 홍수 속에 글로벌 스포티파이 다시 1위 찍은 방탄 정국 'Seven'
81,어릴때 보고 자랐던 잡지.jpg
82,현재 서울 폭우 오는 지역 (강북지역 조심)
83,천연 녹즙 생성 중인 푸바오 🌿🐼
84,더보이즈 주연 과자파티에 초대할 거다 vs 나가라고 소리칠 거다.jpg
85,바오자컨 전할시 내일 오후 6시 예고
86,현재 스튜디오 하나 살렸다는 마고 로비 상황.jpg
87,한 문장으로 사람 개열받게 하는 말 뭐가 있을까
88,15년째 4시간을 자도 전혀 문제없었다는 사람
89,27일 입장문 이후 아무런 해명이나 사과도 않고있는 주호민
90,푸바오가 깐 대나무 홀랑 뺏어 먹는 아이바오 🐼
91,방탄소년단 정국 인기가요 퇴근길
92,수건 한번썼으면 빨아야한다 vs 말려서 다시쓴다
93,배재희 특수교사가 페이스북에 작성한 '주호민과 나' 전문
94,남편이 커뮤 끊으라네요..jpg
95,"[속보] 경기 평택에 시간당 60mm 이상 집중호우, 침수 주의"
96,"인기가요 [안방1열 풀캠,FanCam,앵콜🎥] 방탄소년단  정국 - Seven"
97,"주호민 사건 관련 특수교사들 입장 ""차라리 사표를 내겠다"" 단체 행동 예고"
98,정국 인기가요 1위 앵콜.twt
99,질염 등 외에도 통풍이 중요하다지만 부담스러븐데요.. 하는 여덬들한테 추천하는것
100,삼성 첫 서울 언팩 개최한 이유는 폴더블폰이 한국에서만 핫하기 때문
101,"[인기가요] 7월 마지막 주 1위 방탄소년단 정국 'SEVEN' 🎊+무대, 소감,앵콜라이브"
102,하락세를 넘어 존재감이 사라진 프랜차이즈..
103,후방) 워터밤 권은비 프리뷰+ 미친 팬썹.twt
104,최근 미국에서 난리났던 사진 한장.jpg
105,무능하다고 개욕먹지만 달리 방책이 없어서 계속 연임 중인 선진국 국가수장
106,요즘 애매한 관계에서 결혼식 청첩장을 받으면 고민을 하게되는 이유.jpg
107,병·의원 의사 연간소득 OECD 기준 최상위
108,내년 7월에 열리는 파리올림픽 근황
109,전기 차단기 안내리다가 감전당했던 메이플 유저 최신 근황
110,[KBO] 어제 수비중 상대타자 백스윙에 손목 맞고 교체된 한화 포수 최재훈 첫 검진결과로 미세골절 진단
111,싸이 흠뻑쇼로 잔디가 망가져 훈련을 못하고 있는 프로축구 구단
112,다들 공무원들한테 친절하게 대해주세요...ㅠㅠ 우리의 친구일 수도
113,"현역 스포츠 선수들 인스타 팔로워 수 1, 2, 3등 모음"
114,5대 광역시의 몰락.jpg
115,지옥이 다름없는 충격적인 일본 수달 카페..
116,베트남에서 베트남어 쓴다고 욕먹음.jpg
117,"‘규모 4.1 지진’ 후속 알림 없는 기상청, 전북·전남 구분 못한 중대본"
118,동물과 사육사 관계를 넘어선듯한 푸바오와 강바오 🐼
119,구인할때 페미 어떻게 거르나 조언받는중.blind
120,"방탄소년단 지민 ""Set Me Free Pt.2"" 1억뷰 돌파🎉"
121,폭염에 반려견 산책이 위험한 이유..jpg
122,내 눈에 들어오는 것은 추행범은 추행으로 안 끝나고 자기 이익을 위해서 폭행까지 간다는 것임.twt
123,편두통 때문에 진통제 비타민처럼 달고 다닌 원덬이 추천하는 지압 영상
124,폭염 속 주차장 사망
125,[단독] ‘독도는 日고유영토’ 표현… 4 ~ 6학년 모든교과서로 확대 얘들아이거심각한건데관심좀가져주라 . . 일본 초등생 교과서에 독도도 일본 고유영토라 표기하고 강제징용 문제에서도 강제성 삭제되고 한국이자진해서온거다 이런 식으로 수정된대
126,지금 존나 그리운새끼.jpg
127,"애견호텔 사장 ""장필순 반려견, 횟집 간 사이 차 안에..'열사병 사망' 참담하고 죄송"""
128,판다들이 사육사를 보는 눈빛🐼
129,유니클로 절대 한국에서 이미지 회복 불가능한 이유
130,2023년도 하반기 소아청소년과 레지던트 상급년차 모집 결과
131,[KBO] 신인왕 레이스
132,2년 근무시 10억주는 직장의 실사판
133,흠뻑쇼로 잔디가 망가져 훈련하러 매일 파주까지 150km 이동하는 수원FC
134,의외로 모르는 사람 많은 여성복과 남성복의 마감차이
135,"조병규 '학폭' 폭로자 200억 원으로 '2차 제안'…""韓 경찰조사 받을 것"""
136,2023 르세라핌 투어 ‘FLAME RISES’ 공식 굿즈
137,피해 여학생 측에 사과 거부했던 주호민
138,엔믹스 설윤이 유명해지는데 1프로라도 기여했다고 확신하는 짤.jpg
139,매표소 직원분한테 인사하는 홀란드.twt
140,샤이니 Satellite(새틀라이트) 녹음실 버전 | 레코딩 비하인드 합본 버전 (feat. 작곡가 리액션)
141,카디 비 술뿌린 관객에게 마이크 던져
142,딩크인데 올케가 자꾸 조카에게 뭘 해주길 바래요
143,[KBO] 팬들이 고쳤다고 쉴드 치는데 달라진게 하나도 없는 에레디아 타석
144,알고보면 국내에서 한번도 1위 자리를 뺏긴적 없는 유니클로
145,"""푸바오 유지비 15억원?"" 사실은…판다효과 상상초월"
146,방탄소년단 정국 위버스 업뎃(+추가업뎃)
147,"558만 '엘리멘탈', '스즈메의 문단속' 넘었다…2023년 외화 1위"
148,1980년대와 요즘의 옷 구매량 비교.jpg
149,"인기가요 사녹온 팬들위해 방탄소년단 정국이 준비한 선물 ""저쪽 신사분이☆ 보내신"""
150,사실 밀수 영업 포인트 중 하나로 보이는 거...(노스포)
151,영화 밀수 보고 나온 사람들의 공통적인 평
152,주호민 부인이 올린 웹툰 중에 주호민과의 대화를 올린 부분이 있음
153,조병규 학교폭력 의혹 타격 컸나…‘경소문2’ 시청률 3.9% 출발
154,러바오 생후 9주째 모습
155,방탄소년단 정국 인기가요 출근길
156,혐주의) 내가 트월킹을 싫어하는 이유
157,국민연금 기금본부를 전주로 이전한 결과....jpg
158,성기를 제거하지 않은 트젠 수영선수 앞에서 1주일에 18번 옷을 벗어야 한 여학생들이 학교에 항의
159,"전라 노출 카우치 멤버, ""옷벗지 말라는 이야기는 듣지 못했다"""
160,진짜 잘커줬다 하는 남자 아역배우 출신은?
161,혐주의) 18년전 오늘자로 벌어졌던 최악의 방송사고.gif
162,이번 초전도체 발견에 관한 한국공학대 교수 반응.jpg
163,아들의 동생에 대한 폭력 묘사한 주호민 부인 웹툰
164,쥐한테 빵 나눠주는 까마귀.gif
165,뭔가 뭉클한 중국에서 다시 만났던 강바오와 리리(한국에 있다가 중국으로 돌아간 판다)
166,주호민 부부가 완전 악질인 이유..jpg
167,고기초 특수학급교실 만든 선생님이 주호민으로부터 고소당한 선생님임
168,와플대학에서 강제로 출석금지당한 한 친구 ㅋㅋㅋㅋㅋㅋㅋㅋㅋㅋㅋ
169,밤에 보면 무서울수도 있는 명탐정코난 에피소드
170,카페에서 흔히 보이는 아이 데리고 온 가족 유형
171,"한국말 다 알아듣는 것 같은, 아빠 말에 리액션하는 러바오🐼"
172,아이바오가 아부지에게 보이는 신뢰와 애정 🐼
173,재용이가 꼭 고소해야하는 사람
174,"산업은행 직원, 10명 중 9명 “부산 갈 의향없다”"
175,오늘자 감전된 메이플 유저..JPG
176,"정국이 그리는 방탄소년단 챕터6 ""햐..그때 아미들도 다 할망구 돼 가지고"""
177,월 850 맞벌이 부부의 한달 지출내역.jpg
178,자기 취향이 없는 사람은 재미가 없다
179,방금 끝난 드라마 악귀 마지막화 엔딩.twt
180,얘들아 제발 미국 대학 티 좀 입지 마
181,MC 옷갈아입고 퇴근하는데도 집에 안가는 게스트 방탄소년단 정국
182,"<슈취타>에서 성시경 ""내게오는 길"" & 싸이 ""댓댓"" 쌩으로 부른 방탄 정국 (+ 노래방 풀영상)"
183,실시간 난리난 카리나 비쥬얼.....jpg
184,엑셀로 윈도우 폴더 생성하기 . TIP
185,흥미로운 국내 직업별 스마트폰 브랜드 비율
186,핫게에 있는 외국인애들이 한국에서 머무를 장소.jpg
187,엔하이픈 서울 콘서트에 생각보다 많이 온 듯한  중국인들
188,bl적허용으로 뇌빼고 봐야하는 6억 송금한 집착광공.twt
189,"로또는 2,3등 걸리면 진짜 정신병 걸린다던데"
190,싱글벙글 지나가던 양봉업자.gif
191,오늘 로또 당첨 번호 + 1등 당첨금액과 당첨판매점
192,게스트 방탄소년단 정국 <슈취타> 썸네일
193,드디어 삼성전자에서 울트라23 선물 받은 강바오
194,현재 열대야인 듯한 전국 날씨.JPG
195,폭염에 무릎꿇는 이탈리아노.jpg
196,"김혜수, 안돼... 팬들 더 만나야 하는데~"
197,사람들이 잘 모르는 비타민 C의 황제
198,대한민국 평균 남자외모 ( feat. 방탄 진 )
199,9n~0n년생들은 알만한 그 시절 유행했던 여름 신발
200,사람마다 다른 회사 책상 스타일.jpg
201,소프트 비엘 좋아하는 덬들에게 추천하는 일본 비엘 만화 10작품...jpg
202,호날두한테 국뽕 질문했다가 욕 처먹고있는 일본프로.jpg
203,연휴결혼식 왜 민폐라고 생각 안하나요.pann
204,인도 공과 대학 : 초전도체 재현 실패
205,SHINee 샤이니 | ‘Satellite’ Recording
206,지금 전국 시내에 단체로 돌아다니는 외국인들
207,포브스에서 풀린 정국 Seven 프로듀서들의 비하인드 인터뷰
208,결혼식때 착용하면 은근히 민폐인 악세사리.jpg
209,??? 여자 거르는 방법 알려드림.jpg
210,두산 시구하고 맥주배틀 참여한 이장우 ㅋㅋㅋ.twt
211,호불호 확 갈리는 걸그룹 타이틀 Top5
212,이것만 줄여도 지구온난화에 바로 효과 볼수 있을거 같은 것
213,[지진속보] 07-29 19:07 전북 장수군 북쪽 18km 지역에서 추정규모4.1 지진발생
214,외국인들이 한국에서 느낀 가장 큰 문화충격.JPG
215,2018년 더위가 절정이었을 때 날씨.jpg
216,맛있는 거 먹으면 침이 줄줄 새는 아가 푸바오 🐼
217,태도로 논란 많았던 하이브 연생 근황
218,"<에스콰이어> 셀린느 x 방탄소년단 뷔 패션필름 1,2,3"
219,네이버페이 10원
220,"롯데백화점 화재에도 계속 공연한 ‘오페라의 유령’ ...뮤지컬 팬들, 뿔났다"
221,압도적인 피사체 뷔와 함께한 셀린느 23윈터 패션 필름  l CELINE x 방탄소년단 뷔
222,요즘 우리나라 경제근황
223,고려대가 상온 초전도체라고 발표한 이유
224,최저임금과 공무원보수 수준 비교표.jpg
225,근무시간 강남서 성매매 한 지방판사...파면 못한다
226,멘탈튼튼 최고 된다는 MBTI 유형
227,미쳐버린 바비 흥행
228,안재현 연기력도 아쉬운데…7주째 출생의 비밀 써먹는 KBS '진짜가'[TEN스타필드]
229,11살이 아닌 1살 같은 어제 러바오🐼 사진
230,방탄소년단 정국 위버스 업뎃 (하하하하핳 하......)
231,남친 친구가 남친 많이 취했다고 연락함.jpg
232,사람마다 호불호 갈리는 카톡 대화스타일.jpg
233,오늘 교사 집회 추모 영상에 나온 서이초 선생님 아버님께서 남긴 포스트잇
234,"한국에서 이런 추리 게임 나온 게 정말 얼마만이냐고 추리 게임덬들에게 극찬받고 있고, 스팀 평가 '압도적으로 긍정적'인 국산 추리 게임.jpg"
235,@군데 초딩들은 이름이 뭐여도 놀림 . .어떻게든 놀림.twt
236,역대급이었던 2018년 여름 더위
237,오늘 서이초 사건 교사 집회 항공뷰.gif
238,호불호 시장빵.jpg
239,제일 귀여운 졸린 푸바오 모음 🐼
240,"'주기는 여행중' 측 ""주호민 여파 공개 보류? 현재 논의 중"" [공식입장]"
241,이 날씨에 모인 교사들이 요구하는 엄청난 것
242,쟈니 제목 맞.게 써놓고 물음표 붙이는거 같은 오타쿠로써 무언가의 동질감 느껴짐.twt
243,이제 양산은 생존탬중 하나임
244,세종 신도시 비쥬얼 ㅎㄷㄷ..JPG
245,우리 아파트에서 사람이 죽었는데 아무래도 살인범이 우리 아파트 주민같아요.jpgif
246,이탈리안과 코리안을 동시에 광역도발.jpg
247,메이크업 스태프 괴롭히는 배우 설인아...gif
248,치마가 짧은데 왜 팬티 안보이냐고 소보원에 신고.blind
249,미국의 모 실험에서 굽고 있다는 초전도체 LK99 근황
250,서이초 사건으로 분노한 교사들 현재 광화문 상황.jpg
251,불륜중 아는사람 만난 금사카페회원
252,코 끝 찡해지는 아이바오와 푸바오가 함께 하는 순간 🐼
253,2023년 20대 점유율 역대 최고치 찍은 아이폰
254,일루미나티급인 림버스컴퍼니 일러 페미 (그들만의)논란짤 🤏
255,성기를 제거하지 않은 트젠 수영선수 앞에서 1주일에 18번 옷을 벗어야 한 여학생들이 학교에 항의
256,울림엔터테인먼트 근황.jpg
257,림버스 컴퍼니 사태에서 들고 간 자료가 가운데 정렬인 이유.twt
258,엔하이픈 콘서트 오직 다크문 줄만 깁니다
259,'문신 지우는 영수쌤' 성형외과 원장이 가장 기억에 남는 사람들
260,잘 알려지지 않았지만 림버스 컴퍼니 사태에서 좀 충격인 거
261,공무원 공부한다고 결혼식 안 오는 친구.....이해해 줘야 하나요?
262,살아있는 곰인형🐼과 송바오.gif
263,불륜남이 돈을 안써서 고민인 여자(금사카페)
264,아씨두리안 보는 윤성빈(feat. 뭔 🐶소리야?)
265,@@: 야곱이라고 아세요??
266,뉴진스 아이폰 광고 기사에 댓글 반응... jpg
267,콘크리트 그 자체인 악귀 시청률 추이
268,박보검 인스타 사진 업뎃(셀린느)
269,할미할배들만 안다는 분식집 히든 메뉴....jpg
270,방탄 정국이 좋아한다는 아이스크림에 팬들이 놀란이유
271,"애견호텔 맡긴 강아지…10시간 만에 열사병으로 숨져, 피해 견주는 가수 장필순씨"
272,"[KBO] 키움 최원태 ↔️ LG 이주형, 김동규, 1라운드 지명권 트레이드"
273,사회 출장 중 강남서 대낮에 성매매한 40대 현직 판사 적발
274,햄스터가 사장인 수상한 아이스크림 가게
275,중소기업 갤러리에 나타난 인재
276,이번 르세라핌 서울콘서트 예매자 통계.jpg
277,이번주 금쪽이 솔루션중 부모님이 아이 제압하는 모습
278,요즘 유행하는 인형 키링.jpg
279,"전현무, MZ 마음 얻으면 뭐하나…'나혼산' 7%대 시청률 '폭락' [종합]"
280,초전도체 상황 요약 짤
281,장원영 삼성 행사 끝나니 가차없네…아이폰 샷에 논란
282,진짜로 인정될 것 같다는 초전도체 실시간 현황....jpg
283,방탄소년단 의상 정보 알려주던 계정 근황 (ft.정국)
284,[MLB] 오타니 39호 홈런
285,걸그룹 데뷔곡 중에서 가장 임펙트 있는 곡은?
286,"전 세계 청소년들 오는데 곳곳 '뻘밭'…낮에는 폭염, 밤에는 벌레 '비상'"
287,국회까지 진출한 주호민 사건
288,림버스컴퍼니 진짜 업계인 블라인드 반응
289,남편 화법 진짜 짜증나요
290,어제자 뉴진스 명품 착장 클래스.jpg
291,주호민 포함 요즘 학부모들이 필수로 봤으면 좋겠는 저번주 금쪽이 훈육
292,유튜브 전체화면 꿀팁
293,충격적인 현재 미국 상황
294,이민우 Seven (정국) 챌린지.twt
295,사람들 소리때문에 스트레스 많이 받아하는 것 같은 푸바오
296,딱 반반으로 엄청 갈린다는 재현 얼굴상 댓글.jpg
297,덕질 15주년 기념 굿즈 낸 여돌 홈마
298,[주호민 사건] 피해 학생 부모가 주호민 아들을 용서한 이유
299,주호민은 아들로 인한 성교육 강사 채용에도 간섭했음
300,냉장고에 국밥이 안 굳는다는 리뷰에 울분토한 사장님+후기
301,주호민네 신고로 직위해제된 특수교사 현재 상황.gisa
302,주호민이 보통 멘탈이 아닌것 같은 이유
303,블라인드에서 역풍 제대로 불고 있는 림버스 컴퍼니 사태 반응.jpg
304,네페 10원
305,네이버페이 110원
306,황석희 번역가 인스타 업데이트..
307,방금 업데이트 된 더쿠 게시판 글 이전 진행 상황
308,지금 일본열도를 뒤집어놓은 살인사건
309,"""탕수육 더 안줬다고 학부모가 교실 쳐들어와"""
310,한국인 해초 소비량이 전세계 1위란 말에 긍정하면서도 그 예시로...twt
311,예쁘다고 팬들한테 반응 좋은 오늘자 뉴진스 단체사진.jpg
312,한국 대표 대중음악 평론가 10명의 정국 'Seven'에 대한 평
313,사건전 주호민 팬이었던 초등교사의 생각
314,주호민은 고소한 선생님의 후임보조교사에게도 녹음을 시도함
315,강동원 주연 <천박사 퇴마 연구소: 설경의 비밀> 공식 줄거리
316,노르웨이 인기 하이틴 드라마 '스캄'이 한국에서 리메이크 된다고 함
317,그 시절 미남배우들 틈에서 이 사람들 외모와 분위기에 환장했던 부류가 있었음.jpg
318,강바오 나무위키 프로필 근황
319,미국 남자가 한국 여자랑 결혼했을 때 불편(?)한 점 (feat. 올리버)
320,알고 보면 아이돌 마지막 활동이 22살이었던 아이돌...jpg
321,진짜 잘커줬다 하는 여자 아역배우 출신은?
322,논란에 대해 언급한 침착맨.ytb
323,스파오에서 선보인 평균체형 마네킹..jpg
324,일론 머스크 전부인과 결혼하는 토마스 브로디 생스터.jpg
325,다음카페에 올라 온 '요즘 경험으로 느끼고 있는 이상한 아동학대법'
326,주호민 부부 교사한테 일요일이고 주말이고 밤이고 연휴고 할것 없이 연락해댐
327,"특수교사 ""주호민, 신상 속이고 교육청 문의…아동학대 낙인 찍힌 삶 살고싶지 않아"""
328,"일론 머스크: 트위터, 더 이상 라이트 모드 제공하지 않고 다크 모드를 기본으로 만들 것"
329,할부지랑 이모가 가버리니까 당황해서 당근도 안먹고 내려 놓은 푸바오🐼 (눈물주의🥺🥺)
330,"이석배 교수, ""초전도체 논문은 무단으로 올려진 미완성 논문이다."""
331,올해 5월 또 학교서 몰래 녹음하다가 들켰다는 주호민네 녹취시도 이유 (다른 학부모 제보)
332,보다가 눈물 찔끔 흘린 오늘 전할시 강바오 멘트 🥺
333,점심메뉴로 김밥 나온 중소기업
334,잠실 롯데월드x 롯데백화점o 불났다고 함
335,JTBC에서 주호민 사건 학부모 제보받은거 썰풂
336,주호민 입장문에 분노한 학부모의 제보(방금 사건반장)
337,기저귀 더 달라는 엄마 수용자에 '생리대' 준 구치소
338,오늘자 바오자컨 전할시(전아시)에 나온 소식 2개
339,스포티파이 남자가수 통틀어 가장 빠르게 2억 스트리밍 돌파한 방탄 정국 Seven
340,워터파크 파도풀 성추행
341,드디어 서인국 입에서 나온 ‘그’ 단어.jpg
342,에버랜드에 놀러간 바오가족🐼
343,타커뮤 유저가 생각한 주호민 고소 사건에 많은 사람들이 분노하는 진짜 이유.jpg
344,주호민 사건에서 많은 사람들이 잘못 알고 있는 점(고소 취하 관련)
345,4대 기획사의 마지막 멜론 일간 1위곡.jpg
346,인피니트 킬링보이스 Man In Love (남자가 사랑할때)’ 선공개
347,[단독]용진이형이 구했다…이마트 '먹태깡' 1인 2봉지 한정 판매
348,탈덕수용소 고소를 위해 자료 수천개를 모두 영어로 번역했다는 스타쉽.gisa
349,낭만이 엄청난 초전도체 연구팀
350,지금 초전도체가 중요한게 아닌 이유.txt
351,사람들이 의외로 대기업인 줄 모른다는 국내기업
352,비정상회담 당시 외모 인기투표 1-3위.jpg
353,또 다른 고려대 초전도체 발표현장 후기.txt
354,현재 상온 초전도체 상황 정리.jpg
355,티빙 공트 답멘 현황 (킹더랜드)
356,특수교사 입장문 봤어??
357,현재 한국 생태계 파괴 시키고 있는 빌런새
358,턱 괴고 엎드려 있으면 더 귀여워지는 푸바오🐼
359,명탐정 코난 최고 인기 삼인방.jpg
360,"[단독] 4차선 교차로서 28개월 아이 홀로 아장아장…부모, 어린이집 고소"
361,찐막) 초전도체 학회 후기.jpg
