,content
1456,"중국 테니스 선수, 상대 비신사적 행위에 경기 도중 기권"
1457,＜새벽 2시 이후에 자면 수면 효과가 절반이다＞
1458,"영국 BBC Radio에서 완전 쌩라이브로 노래 부른 정국 (오아시스 ""Let There Be Love"" 커버 & Seven)"
1459,"확신의 올라운더인 엔시티 재현.jpg (영업글,스압)"
1460,녹음할때 사람 자존심 다 갉아먹고 스트레스 주는 타입인 jyp 박진영
1461,서이초 사건 관련 추가 제보 발표한 서울교사노조
1462,우리 세대 뭔가 자기연민 쩔고 결핍없는거에 환상있는거 같음.jpg
1463,선생님 사망 가정통신문도 학부모회에게 검열받았던 고인의 학교
1464,임영웅 팬클럽이 사흘간 모금해서 수재민들에게 오늘 기부한 금액.jpg
1465,은근히 아동학대다 아니다 논쟁이 있는 행위
1466,미혼여성이라면 자주 겪는 유쾌하지 않은 농담.jpg
1467,현직 교사로서 서이초 사태에 대해서
1468,네이버페이 1원
1469,뉴진스 NewJeans 'Cool With You' Official MV (Performance ver.)
1470,배달음식 끊은 여동생이 장하다고 음식 만들어준 오빠
1471,고학년 담임을 맡고 3월에 받은 가정환경조사서
1472,이번주에 시작했다는 가비 버블 현황
1473,나스 화장품 대참사.jpg
1474,지금 한국의 대통령은 푸바오🐼🐼 입니다.
1475,아기바오 약 2주만의 변화 한눈에 보기
1476,블라인드에 올라온 서이초의 진실글
1477,찐으로 세계에서 먹히고 있는 핫한 한식
1478,갓 입대한 미국 여군이 사임한 이유
1479,새로뜬 방탄소년단 제이홉 군대 사진
1480,스포티파이 역사상 가장 빠르게 1억 스밍 달성했다는 방탄 정국 신곡 Seven
1481,방금전 홍김동전에서 의견 갈렸던 주제
1482,"리사 수 ""한국 언론을 믿냐"".jpg"
1483,강아지 미용 맡기고 데리러 갔는데 강아지가 사라진거야;;
1484,님들아 유치원 교사는 학부모들이 인스타 팔로해서 몇시에 피드나 스토리 올렸는지도 봅니다.twt
1485,"영화 밀수 시사회 아이유 ,윤아, 지수 .jpg"
1486,한국에서 구속 수사 받는 방법
1487,가슴 몽글몽글해지는 푸바오 ❤ 송바오 (스압)
1488,중국이 한국한테서 지키고싶어한다는 공자
1489,mbti로 자기 반응 달아보세요~!
1490,인체를 너무 잘그려서 어떻게 공부했냐고 웹툰작가한테 물어봤더니.jpg
1491,"중국 MZ세대에게 한국, 미국, 일본 중 어느 나라가 제일 싫은지 물어봄"
1492,현직 교사1) 자는 애를 깨울 수도 없어요. 기자) 왜요?
1493,“집값 떨어질까봐”…‘침수 낙인’ 우려에 물막이판 거부한 입주민들
1494,"담임폭행 양천구 초등학생 ""전학"" 결정"
1495,서천석 소아청소년정신과 전문의가 쓴 금쪽이류의 방송이 유해한 이유
1496,박정민 배우 응원간 배도라지
1497,연세우유빵 득표 현황
1498,"""씨알도 안 먹히는데…"" 오은영 '금쪽이' 방송 비판한 박사"
1499,아이돌 더쿠들에게 닥쳐올 미래.jpg
1500,아이돌 더쿠들에게 닥쳐올 미래.jpg
1501,BBC '라이브 라운지' 방탄소년단 정국 'SEVEN' 'let there be love' 라이브
1502,오늘자 아이유 밀수 시사회
1503,"서초구 초등학교 수정된 입장문…""학부모회 검토과정서 빠진 듯"""
1504,졸업앨범에서 점점 교사들 얼굴이 빠지기 시작하는 이유
1505,서강대는 왜 존재감이 없는가? 에 대한 고찰
1506,충격적인 어제자 어느 아파트 근황.jpg
1507,추모 거부한건 서이초임
1508,7월 셋째 주 <엠카> 1위 방탄소년단 정국 'SEVEN' 🎉
1509,서이초 유가족 분들 기자회견 하셨네
1510,서이초 교사님 생전 글.jpg
1511,"""우리 아들 보낼 수 없어""…해병대사령관 붙잡고 통곡한 엄마(종합)"
1512,서이초 동료 교사 제보 뉴스
1513,서울 지하철에서 작동하는 꼬라지를 본적없는 물건
1514,"교사의 입에서 ""조심하겠다""라는 말을 듣고 돌아와야 합니다."
1515,굉장히 인간적인 방탄소년단 뷔의 운동 루틴
1516,에버랜드 바오네 영상 아웃트로(?) 바뀜
1517,진짜 미친거같은 요즘 우리나라 상황들
1518,요즘 학생 애들 돈 씀씀이...jpg
1519,얼굴은 그대론데 키가 엄청 커버린 11살 엄지온
1520,이즘 개설한 이후 역대급 혹평 내린 앨범
1521,예전엔 쌌던 식자재
1522,서울시 서이초 서초구. 교사 추모식 현장 중계
1523,"[속보]헌재, ‘이태원 참사’ 이상민 행안부 장관 탄핵심판 25일 선고"
1524,"현재 맘카페 인기글 ""저는 초등교사입니다"""
1525,"얼마전 초등교사 폭행했던 아이 부모.""용서구하고 사죄하겠다"""
1526,운동하는 방탄소년단 뷔 (위버스)
1527,씨유 어플에서 단종된 연세생크림빵 투표중
1528,아무것도 안하고 그저 추모하는 사람들 내쫓고 교문막는 경찰(ㅅㅇㅊ 실시간)
1529,무늬 생긴 2주차 쌍둥이 바오바오들.jpg
1530,일본에서 오염수 방류 찬성 집회중인 엄마부대
1531,논란 중인 학부모와 소송해서 이긴 교사
1532,티라노 사우루스 복원도 변화 jpg
1533,psg 경기보느라 ㅇㅇㅇㅇㅇㅇ도 못알아본 파비앙
1534,유튜브 프리미엄 가격 인상 예정
1535,방탄소년단 뷔 인스타 스토리 😤
1536,토요일(7/22) 초등교사 집회 예정이라고 함
1537,서이초 화환 근황
1538,AI 논란으로 하루만에 표지 교체한 웹소설.jpg
1539,'경상북도 안동'하면 떠오르는 건?
1540,"90년대 최고 인기브랜드였다는 ""스톰292513"".jpg"
1541,<본인등판> 엑소 디오 도경수 출연
1542,트래비스 스콧X더 위켄드X배드 버니 'KPOP' 가사 일부
1543,부모님 용돈 배달사고의 현장.jpg
1544,"🐼🩷생일기념 할부지들,팬들이 만들어준 모빌에 무아지경 뚠빵이(약 스압)"
1545,"헌재, 책값 할인율 제한 '도서정가제' 합헌 결정…전원일치"
1546,반쯤 직장인 출근템된 유나의 애착가방
1547,대한민국 해병대 SNS 故채수근 상병 추모
1548,환승연애 해은 인스타 업뎃 (청룡어워즈)
1549,해연들 새 콜라보 곡 “KPOP”의 커버 사진이 일장기 같다는 논란.twt
1550,심리학자1: 아이를 이해하고 그랬구나 수용하며 키움 vs 심리학자2: 보상과 처벌로 키움 - 어느 아이가 누가 감옥에 갔을까?
1551,숨쉬기 운동만 하는 덬들에게 추천하는 10분 모닝루틴
1552,💚영원한 아기판다 푸바오💚 세 살 생일을 축하해!🎉
1553,"[속보] 책값 할인율 정한 '도서정가제'…헌재, 합헌 결정"
1554,미국 파워볼 1등 당첨자 나옴
1555,"양조위, 뉴진스 MV 노개런티 출연 ""韓 팬들에게 선물하고 싶었다"""
1556,(펌) '반지의 제왕'에서 나즈굴 무리가 호빗들만 보면 난리를 쳤던 이유...jpg
1557,애인 차 안에 콜라 쏟았는데 40만원 물어달라고 함
1558,폭우에 집이 떠내려가서 인터넷 해지를 하게 되면?
1559,"""근조 화환·꽃다발 멈춰주세요"" 호소한 학부모, 비판 쏟아지자 글 삭제"
1560,대학교도 교수님한테 학부모가 전화해?
1561,"김영환 첫 사과 ""한두명 사상만 난 줄…일찍 가도 바뀔 건 없어"""
1562,요즘 초등학교 수학여행
1563,JYP 사옥 앞에서 트럭 시위 중인 ITZY 채령 중국 팬덤
1564,"가수 청림, 대장암 투병 중 별세…향년 37세"
1565,"스트레이키즈 현진, 베르사체 글로벌 앰버서더 발탁"
1566,핫게간 문자 학부모 후속
1567,"분명 오은영도 아이들 악을쓰고 떼를 써도 사회규칙은 엄격하게 훈육, 폭력은 무조건 안됨 단호하게 가르쳤음"
1568,요즘 존나 꼴값떠는 대한민국
1569,[단독] CJ ENM “티빙ㆍ웨이브 합병 안한다”…살아 날 묘책이라도
1570,"""가난한 사람은 저런 곳에 사는구나"" 소리 들었던 배우 근황.jpg"
1571,푸바오🐼 2차 생일 케이크🎂
1572,학부모 개진상 민원 모음집.blind
1573,유투버 쯔양 근황.jpg
1574,미국 식당에서 식사 후 받은 계산서
1575,"25일 출시, 스타벅스 x 블랙핑크 콜라보 제품 안내(블랙핑크 카드 포함)"
1576,수해지원나간 해병대 장병들 식사 장면
1577,앞으로 10년 뒤면 살인사건 많이 일어날걸.dc
1578,[위버스매거진] 방탄소년단 정국 화보+인터뷰 “제 스스로가 좀 바뀌고 있는 것 같아요”
1579,환승연애2 현규 & 수지 투샷
1580,출연자 전원이 틀린 문해력문제
1581,환승연애2 정현규 인스스 업뎃 (feat. 차은우)
1582,서이초 공식입장 수정됨
1583,서이초 사망 교사 사촌 오빠가 단 걸로 추정되는 댓글+추가 유족측 장례 거부
1584,셀프계산의 본질적 문제를 꼬집는 현수막
1585,주차구역이 안보여서 오디오 소리를 줄임.jpg
1586,가성비로 프랑스 여행하는 방법.twt
1587,"아슬아슬 선 넘나드는 K팝 트럭시위, 팬덤인가 갑질인가"
1588,유한양행이 신설한 출산축하금
1589,"늑장 논란 김영환 충북지사 ""일찍 갔다고 바뀔 게 있나"""
1590,야 어제 어떤 선생 죽었더라
1591,근면성실 반차없이 오늘도 출근한 러바오🐼.gif
1592,"""내 아들을 괴롭혀?""…학폭 중학생들 '뺨 100대' 친 아빠"
1593,서이초 공식 입장 (수정전)
1594,푸탄일🐼❤️ 케이크와 사랑에 빠진 푸바오(실시간)
1595,오늘 생일상 받은 푸바오 상황.gif
1596,"서울 강남 서이초 초등학교, 학부모 갑질 사건 정리글.jpg"
1597,'극단 선택' 서초 초등교사 학교 앞 추모하는 초등학생들
1598,"하하, '고딩엄빠3' 하차하며 남긴 말 ""피임 잘합시다"""
1599,밖에 나가면 뭐든 너무 힘이 들어서 집에 가고 싶다는 미주.jpg
1600,와 진짜 요즘 2030 정서 그대로다... 소름돋을만큼 이 한 장에 다 담김.twt
1601,(요즘 학부모 수준) 저도 편법으로 선생님을 죠질수 있다는것만 기억해주시겠어요^^☆
1602,서이초 교사 자살은 단순히 교육계만의 문제가 아니다
1603,초임 교사 자살로 몰아간 학부모가 한 말.jpg
1604,초등학교 교사가 새벽 1시에 받은 문자
1605,오늘자 인천공항 아이브 장원영.jpg
1606,한기호 의원 공식 입장문: 손자손녀 서이초 안다님 앞으로 허위사실유포하면 고소하겠음
1607,추모 꽃다발 놓는 학생
1608,학원 강사에게도 예외없는 멍청한 학부모 민원
1609,카카오 택시 근황ㄷㄷㄷㄷㄷ
1610,넷플릭스 <마스크걸> 주오남 삼킨 안재홍.jpg
1611,실시간 중국 ipanda 유튜브 푸바오🐼 생일 라이브 중
1612,서이초 교사 추모했다가 아침 7:30분에 학부모한테 받은 문자
1613,노키즈존을 반대하는 가장 큰 이유.jpg
1614,"현직 초등교사가 겪은 금쪽이, 그 반의 현실 알려드립니다"
1615,기사 팁주기 기능 도입한 카카오 택시
1616,"[르포]""주휴수당이라도 없애주면 안되나요?""…'나홀로 사장님 ↑'"
1617,"서이초 1학년 해당반 학부모 트윗 (교사 바뀐적X, 대부분 학부모들도 해당 교사 좋아했다)"
1618,[단독] '극단 선택 서초 초등교사' 오늘 추모문화제 연다
1619,이게 학부모다
1620,서이초 추모 근황
1621,예천서 실종된 해병대원 숨진 채 발견
1622,"[단독] 뷔, 3분기 솔로출격…방탄소년단 최종병기 등판"
1623,오늘부터 트렌타 사이즈 판매하는 스타벅스
1624,서이초 교사분 자살사건 관련의혹 국회의원  입장표명
1625,현재 서이초 앞 근황
1626,방탄소년단 지민에게 기타를 주고싶다는 라이언 고슬링 (feat. 켄)
1627,"내년 최저임금 9860원, 도쿄보다 높다"
1628,한국인들이 잘 모르는 친일일뽕 국가
1629,서이초 교사 사망사건 유가족 댓글
1630,엘리멘탈은 잘하면 올해 외국영화 흥행 1위도 노려볼수 있겠습니다.
1631,한국 프로야구 굿즈 역사에서 반응 좋았던 굿즈 vs 다들 충격받았던 굿즈
1632,"조희연 서울시교육감 ""서초구 초교 극단 선택 교사 명복 빌어, 사인 파악 아직"""
1633,교원평가 성희롱 공론화하셨던 선생님 결국 퇴직하심
1634,얼마전 초등학교에서 일어난 끔찍한 아동학대
1635,뉴진스 신곡 Cool With you 뮤비 해석
1636,베트남 비엣젯 항공 선택했다가 4박 5일 여행 강제로 3박 4일 된 후기
1637,내일 아침 서이초 교문 앞 상황 예언함
1638,더쿠덬이 찍은 현규 해은 퇴근길 손잡는 영상
1639,추모객들이 늘어나고 있는 서이초 정문앞 상황
1640,[KBO] 야구팬들 떨고있는 오늘 10개구단 단장들 일정
1641,뉴진스 신곡 뮤비에 양조위 출연
1642,오늘은 푸바오 3살 생일🐼🎉
1643,중국인들이 공항에서보면 화나는 장면.jpg
1644,뉴진스 NewJeans 'Cool With You' Official MV
1645,"요새 틱톡, 유튭에서 종종 언급되는 4세대 여돌 비주얼 라인 “장카설”"
1646,핫게간 덱스한테 뽀뽀하는 홍석천은 미리 양해 구했다고함
1647,숙소 운영 자금이 없어서 각자 집 구해서 잠시 나가라는 얘기를 들었던 연습생 시절 방탄소년단
1648,엘리멘탈 제작진이 공개한 미공개 캐릭터 '스팀베이비' 영상
1649,라치카가 가비한테 말안하고 청룡어워즈 축하무대하러 나왔는데 가비가 무대 올라감
1650,"[속보] 경북소방 ""예천 고평교서 실종 해병대원 발견해 인양중"""
1651,내일 우리나라에서 개봉한다는 우익작가 영화
1652,"""시험관 시술로 어렵게 얻은 아이인데""…실종 해병대원 사연에 눈물"
1653,일본 연간 1위각이라는 요아소비 '최애의 아이'ost 를 넘은 정국 신곡
1654,이제는 정말 사회적 현상임을 인정해야 할 것 같은 직종
1655,체벌보다는 교사 권한이 필요함 (일톡 펌)
1656,제2회 청룡시리즈어워즈 수상자
1657,"'수리남' 하정우, 남우주연상 ""최민식이 받을 줄 알았는데…"" [청룡시리즈어워즈]"
1658,청룡시리즈어워즈 대상 송혜교
1659,"투피엠 것들 가만 안둔다는 송은이, 김숙"
1660,매번 교권추락 이슈로 자주보이는 교사 관련글 패턴들
1661,방탄소년단 슈가 🍸<슈취타> EP.15 게스트
1662,지금 여러 커뮤에서 토론중인 주제: 교사의 훈육을 어느정도 허용해야한다 vs그래도 절대 안된다 너덬들의 생각은?
1663,단 일주일 동안 있었던 초등학교 교권 근황
1664,블라인드) 서이초 인근에서 근무하는 교행이다
1665,웹소설 적당히 봐야하는 이유
1666,어린 선생님 자살로 몰아간 학부모가 하는 말
1667,에버랜드가 덕질콘테스트 선물로 준 바오걸즈 실물 쿠션
1668,우리나라 건축물 미감이 낮은걸 알 수 있는 또 하나의 사례...(울릉도 첫 글로벌 호텔 체인).JPG
1669,청룡시리즈어워즈 드라마 여우주연상 수지
1670,진짜 현실 P의 여행
1671,(배주의)EBS 귀하신몸 리얼타임 15분 복부비만탈출하는 초간단 9가지 운동법
1672,서이초 정문에 놓여진 조화와 포스트잇들
1673,엥 러바오 세수하는거 우리 아빤줄
1674,서이초 동료교사 제보 내용 포함된 서울교사노조 성명서
1675,서초구 신규교사 자살사건관련 해당지역카페 글
1676,「일본 여행간지 15분 만에 여성 3명 성추행 한 30대 한국남성 체포」
1677,"유튜버 주호다, 서기채널 입장문 발표.jpg (헤어몬 관련인듯)"
1678,서이초 관련 서울시 교육감 입장
1679,"공중파, 언론사에서 서초구 신임교사 자살 사건 물었음"
1680,은근히 갈리는 하트시그널2 vs 환승연애2 화제성 대결
1681,머글과 덕후의 차이점같은 실시간 현규해은 ㅋㅋㅋㅋㅋ
1682,민원으로 학교 초토화시킨 학부모(빡침주의)...jpg
1683,동료가 육아휴직쓰면 내통장에 130만원?…‘육아응원수당’ 한국 상륙
1684,서초구 신규 교사 극단적 사건에 대한 서울시 교육청의 입장
1685,"이수정 교수 “학폭, 학교전담 경찰이 맡아야.. 학교에 떠넘기는 건 넌센스”"
1686,도와줘라... 어제 발령난지 4개월된 신규 교사분이 돌아가셨다.
1687,늙은신입 왜 자기 따시키냐고 회사에서 울음ㅋㅋㅋㅋㅋㅋㅋㅋㅋㅋ
1688,청룡시리즈  신인남우상 약한영웅 <박지훈>
1689,덱스한테 뽀뽀하는 홍석천
1690,학교 실내 가림막서 추락한 초등생 중상…학생 안전관리 ‘사각’
1691,거의 얼굴로 영상 화보 찍은 듯한 방탄 정국 seven 뮤비 스케치 짤들
1692,심각한 초등학교 교권 근황
1693,민증이 있는 나라와 없는 나라의 문화차이
1694,청룡시리즈어워즈 레카 걷는 차은우
1695,여친이 바프찍고 그 후로 인스타에 몸사진 올리는데 올리지 말라고 하는거 오바냐?
1696,수지 백상 vs 청룡 레드카펫 스타일링 비교.jpg
1697,서울 서초구 초등학교 교실서 1학년 교사 극단적 선택
1698,청룡시리즈어워즈 레드카펫 소녀시대 윤아
1699,제자에게 폭행당한 초등교사가 다른 제자들에게 받은 메세지..jpg
1700,서이초 신규교사 자살과 관련해 교육청에서 엠바고 걸었다는 블라인드 썰
1701,청룡시리즈어워드 레드카펫 박지훈
1702,청룡시리즈어워즈 레드카펫 수지
1703,오늘자 새로운 국면을 맞이한 충격적인 오송 지하차도참사 근황
1704,청룡시리즈 어워즈 레드카펫  도경수
1705,청룡시리즈어워즈 레드카펫 차은우
1706,생각보다 촘촘하게 하루 일정을 소화하는 푸바오
1707,서울 신규교사 극단적 선택
1708,서이초 근황
1709,청룡시리즈 어워즈 레드카펫 - 덱스
1710,청룡시리즈어워즈 레드카펫 환승연애2 성해은
1711,[Episode] 방탄소년단 정국 'Seven (feat. Latto)' 뮤직비디오 촬영 현장 비하인드 공개! 🐰👇🎬
1712,비온뒤 갑분 가을맞은 남부지방 기온.jpg
1713,??? : 졸업하려고 전공 몇 개 취소했다
1714,어디까지 갈지 놀라운 5일차 스포티파이 정국 Seven 근황
1715,의외로 유사먹는 팬들 많다는 남자가수 둘.jpg
1716,“아프리카? 너희 나라로 돌아가”…인종차별 남발한 어린이 영양제 광고
1717,새벽에 전화와서 여름동안 에어컨 빌려달라는 동네언니
1718,JYP 박진영 냥줍 의심 달글
1719,"BTS 뷔·정호연, 뉴진스 MV 촬영 목격담…어도어 ""확인 불가"" [공식입장]"
1720,유튜버 해쭈 남편 인스타그램 업데이트
1721,"'저가 코스프레좌', 한소희-BTS 정국 변신…전 세계 누리꾼 '폭소'"
1722,ISTJ인 켄지가 작사한 ENFP의 ISTJ 사랑법 (절망편)
1723,오늘 공개된 푸바오 외할아버지 루루 최근 근황 사진
1724,"KBS, '가요대축제' 日개최 반대 청원 답변..""글로벌 페스티벌로 확대""[공식]"
1725,김민재 입단 소식들은 샤이니 민호 인스스...jpg
1726,우리나라 교권 추락시킨 장본인들
1727,블라인드에서 내전 터진 GS
1728,야 존댓말한다고 다 설레는거 아님 내 친구커플 존대쓰는데 싸울때 존나 살벌...
1729,지성들은 마른세수 못한다는 말 ㅈㄴ 웃김
1730,한국인들 사이에서 제법 있다는 식성.jpg
1731,"새로 시즌 시작하는 드라마인데, 이름이 에스쿱스급🔥"
1732,농심을 업계 최고로 만든 기적의 5년...JPG
1733,MC몽 인스타그램 업데이트
1734,@: 가터벨트님.... 가터가든님... 가든말든님....
1735,(스압) 저출산 대책으로 제시되고 있는 외국인 가사도우미의 실체
1736,웹툰 낮에 뜨는 달 드라마화 설정 및 캐스팅공개.jpg
1737,"""내년 최저임금 9920원 될 수 있었는데.... 민주노총 반대에 무산"""
1738,라이언 고슬링이 바비 영화에 대한 설명을 거절한 이유.twt
1739,"""착하게만 산 우리 아들인데""…실종 해병대원 엄마는 오열했다"
1740,비상계단 막아놓고 뻔뻔한 주민.jpg
1741,최저임금 인상으로 기업들 망하는 거 확정됨.jpg
1742,"""외국인 가사도우미 월 100만원 정도여야 중산층도 이용""(종합)"
1743,다들 직장에서 여름 휴가비 얼마나 받으세요?
1744,최저임금위원장 “최저임금 상당히 높다…자부심 느껴야”[일문일답]
1745,블라인드) 제 아내가 폭행을 당했습니다.(초등학생이 교사 폭행)
1746,슈카는 하지 못하는 인구와 결혼이야기.jpg
1747,[한블리] 65세 택시기사님 폭행한 98년생 해군 중사
1748,"내년 최저임금 9860원…소상공인들 ""감당 못한다"" 반발"
1749,멜론 일간 순위 & 24시간 이용자수 올해 남돌 최고 기록 경신한 방탄 정국
1750,"MC몽, 카이·백현 녹취록 입 열었다 ""의도적 짜깁기..수차례 협박""[입장전문]"
1751,방탄소년단 뷔 인스타 업데이트 (w. 까르띠에) + 인스타스토리
1752,크라임씬 관련 박지윤 인스타(트위터 펌)
1753,예천서 수색 투입된 해병대 일병 1명 급류 휩쓸려 실종
1754,[속보] 실종 해병대원 발견됐지만 다시 급류에 떠내려가…구조 난항
1755,국무총리실이 특급 비밀에 해당하는 보안 자료인 대학수학능력시험(수능) 출제·검토위원 관련 자료까지 가져 갔다.
1756,아이브 안유진 아이스버킷 챌린지 일천만원 기부
1757,강바오 메밀배개로 막기 벅차보이는 신생아 푸바오
1758,‘월북’ 주한미군 얼굴 공개
1759,전남대 헤르미온느.jpg
1760,"삼성페이, 수수료 무료 유지.. ""카드사들과 지속 상생"""
1761,요즘 2030 진상 정서 그대로 담긴 사진
1762,"구토하는 며느리에 ""꾀병, 술상 치워""…남편까지 합세 + 네이트판"
1763,침수당할꺼 같으면 차버리고 도망가야함.
1764,브라질 여성팬을 구한 한국 군인 사진
1765,평소에 혀를 어디에 두고 있음? 혀 위치에 따라 턱라인 달라지는 영상
1766,집 주소 속였다가 해고 당한 신입사원 논란
1767,방탄소년단 지민과 정국 몰래 영상 찍고 조롱한 요트 선장 (기사 캡쳐)
1768,예쁜 판다로 알려진 푸바오 또다른 이모바오 '바이티엔'
1769,"피프티피프티, 바비 뮤비 촬영을 수락했으면 전홍준 대표가 X될뻔한 이유"
1770,🐼 푸바오 강바오 무릎판다 시절
1771,장기보관된 짐(캐리어)에서 발견된 아이 시신2구 친모가 살해혐의로 신상공개됨
1772,(긴급속보) 굽네치킨 9천원 할인 받자 !!!!!!!!!!!! (쩌렁쩌렁)
1773,한 스트리머가 갤럭시만 쓰다가 아이폰 갈아탄 이유
1774,비행기 좌석에 누가 쉬하면 어떻게 처리하는지 알아?
1775,푸바오가 채혈을 잘하는 이유 🐼
1776,"[단독] 박서함, 소집해제 후 복귀작은 사극 '탁류'"
1777,어제 출시된 엽떡 마라떡볶이 후기
1778,"주지훈 “하정우와 일주일에 4번은 만나, 보름 여행 가기도” (살롱드립)"
1779,해병대에서 한대도 맞지않고 전역한 후임
1780,채혈대 연습 시작한지 얼마 안된 아기 푸바오.twt
1781,한국에서 침착맨 닮은거로 유명했던 중국배우 다른 사진.JPG
1782,갤럭시 쓰는 여자는 이악물고 잡아야됨.jpg
1783,‘바비’ 그만 좀 떠먹여줘[편파적인 씨네리뷰]
1784,갓세븐 제이비가 디엠 보낸 여성 분이 올린 인스스.JPG
1785,예쁜 알약으로 바이럴 되었던 알약
1786,아기 판다🐼들이 평평한 나무를 보면 자주하는 자세
1787,네페10+10 네이버페이
1788,네이버페이 10원(소진)+1원
1789,SM 신인 남돌로 데뷔한다는 윤상 아들 이찬영 지금까지 풀린 사진
1790,네페10
1791,[단독] 살릴 수 있었다…7시 4분·7시 56분 112에 차량 통제 요청 감리단장 통화 단독 입수
1792,다음주 빌보드 HOT100 중간예측
1793,혐주의) 현재 <건물주도 힘든 이유> 라는 제목으로 돌아다니는 역대급 자취방 사진(원덬이 커뮤 하면서 본 자취방 중 최악)....JPG
1794,까르띠에 앰버서더 방탄소년단 뷔
1795,피프티피프티 사태가 남긴것
1796,사람들마다 반응 극과 극인 결혼 준비.jpg
1797,"선생님 수십대 폭행하고는 ""나만 차별했다""며 교육청에 신고함."
1798,폭우가 내린 군산을 아무 피해 없게 만든 슈퍼맨 공무원 공개. gif
1799,교육할 일이 있으면 학교에서 하면 되지 자꾸 이래라저래라 가정 교육에 말얹는 기분이라 기분이 나쁘셨다는 학부모
1800,일본에서는 화제였는데 한국인들은 잘 모르는 가짜뉴스
1801,스르륵 잠드는 모습이 귀여운 러바오 🐼
1802,노트북 수명 2배 늘리기.jpg
1803,위생 걱정 겁나 되는데 어린 애들 사이에서 더 유행인 음식 .jpg
1804,"[속보]내년 최저임금 9860원, 올해보다 240원 인상"
1805,일본인 케이팝 팬들 난리치고 있는 뉴진스 신곡 컨셉
1806,핫게 여성 서사만 접혔다는 영화 포스터
1807,"엑소 첸, 백현, 시우민이 SM 탈출에 실패한 이유.jpg"
1808,월북미군이 공항에서 도망갈 수 있었던 이유 이제 나오기 시작함
1809,우리 푸바오 🐼 아직 아기에요 (무서울 때 손 쪽쪽 빠는 푸애기)
1810,왠지 동아시아에서 한국만 요리법이 발달하지 않은 채소.jpg
1811,한글로 적은게 훨씬 더 힙하고 멋있다.twt
