,content
1093,세븐틴 우지가 1년 기다린 ’옴팡지게 우아해‘ 이모티콘 출시! + 우지반응
1094,헤메코로 팬들에게 반응 좋은 뉴진스 해린 음방무대.gif
1095,실시간 개같이 민심 부활한 게임.jpg
1096,네이버페이 10원
1097,[SNL코리아] 23살 기존쎄 MZ 신입 사원...jpg
1098,치짜이 이웃 판다 짝귀 아바오🔧🐼
1099,리얼 미국식 딸기 도넛...........gif
1100,"콘서트에서 팬들의 앵콜에 ""조용히 해!!"" ""안돼!!""를 외친 아이돌"
1101,(펌)신림동 피해자 가족입니다.jpg
1102,덬들이 좋아하는 여자 라이징 스타는?
1103,윤은혜는 커피프린스 찍으면서 대체 뭘 먹었나.jpg
1104,펌) 일본 국내선 비행기 탈때 쓸 수 있는 외국인 전용 요금제 + 예매방법
1105,보기 중 살 안찌고 건강에 무해하게 만들어줄 음식 3가지만 골라보자
1106,몇년전부터 서양쪽에선 꾸준히 유행인것같은 인테리어 스타일. jpg
1107,방탄소년단 정국  'SEVEN' 안무영상 공개!
1108,"손석구, '가짜 연기' 논란에 ""미숙한 언어로 인한 오해…충분히 반성"""
1109,뉴진스 인기가요 앵콜 직캠
1110,10년 전... 남주 얼굴 하나로 여초를 뒤집어놓은 드라마...jpg
1111,많이 얇아지는 갤럭시 폴드5
1112,에버랜드 강제 샤워 ㅋㅋㅋㅋㅋㅋㅋㅋㅋㅋㅋㅋㅋㅋㅋㅋㅋㅋㅋㅋㅋㅋㅋㅋㅋㅋㅋㅋㅋㅋㅋㅋㅋㅋㅋㅋㅋㅋㅋㅋㅋㅋㅋㅋㅋㅋㅋㅋㅋ.twt
1113,"머스크, 트위터 로고 바꾼다…""새 작별 알파벳 X로"""
1114,더쿠 : 너네 우연히 본 연옌중에 제일 슈퍼스타 말해봐봐...jpg
1115,"충북경찰, 지하차도 참사 순찰차 블랙박스 공개..국조실 감찰 반박"
1116,세븐틴 콘서트에서 현장반응 + 온콘 온에어 반응 뒤집어진 부분
1117,다작왕으로 유명한 히가시노 게이고의 출간작들
1118,모 커뮤니티 회원이 울분에 차서 쓰는 글.theqoo
1119,히피펌 한 뉴진스 해린 앨범 사진....jpg
1120,만화 빨강머리앤이 먹고 산 음식들
1121,요즘 백화점 주차 안내원에게 지급되는 것.jpg
1122,최근 헤메코 바뀐듯한 뉴진스 민지 근황
1123,전효성 욕하던 남초카페 회원들 근황
1124,육아휴직 하고 좀 이따가 퇴사하려고 했는데.jpg
1125,남친이 물고 빨던 여동생이 남이랍니다! 이해하실 수 있나요?
1126,엄복동의 나라인 한국은 자전거 절도율이 정말 높은가?
1127,(긴급) 초성 해석 부탁드립니다ㅠㅠ
1128,트위터 새(not bird) 로고로 추정되는 것..
1129,판다가 중국어로 웅묘인 이유
1130,겨드랑이 암내 참을 수 있으면 ‘연봉 23억’ 받는 직업.jpg
1131,탐폰 뺄 때 드럽게 아프다면 흡수체가 안맞는거일수도
1132,생리할때 두통이있는 사람들에게 효과있는 방법
1133,신림역 살인사건 보고 지하철에서 실신했다는 펨코인
1134,내일부터 트위터 = 짹 로고 아님
1135,일본에 만드는 중인 90조짜리 신칸센
1136,18년생이지만 아직도 같이 지내는 판다 멍란 쌍둥이 여동생들.jpgif
1137,일본 문신바오가 찍은 오늘자 푸바오
1138,요즘 각종 디자인 작업물에서 보이는 영문 폰트 대체 무료 폰트 추천
1139,한국에 있는 지리는 고목들.....jpg
1140,빡침주의) 누가봐도 면제인데 4번이나 현역판정으로 끌려온 32살 신병
1141,배민 리뷰보는데 사장님이 연세있어보이면 마음이아파..jpg
1142,"히로스에 료코, 이혼 발표"
1143,입사 한달차 아들뻘 매니저와 함께 일하는 지석진.jpg
1144,한국인만 먹는건 알았는데 북한도 안 먹음
1145,밤길이 무섭다던 전효성 3년간 사이버 불링하며 악플단 남초 근황
1146,지역에 있던 유일한 소아과 폐쇄 이유 (+)
1147,한솥도시락피셜 불변의 1위..JPG
1148,절도범을 미행한 초딩들.jpg
1149,중국으로 반환된 일본판다 ‘샹샹’의 근황
1150,신림역 사건 남초 커뮤 '일부' 반응들
1151,요즘 맘카페에 돌고 있는 진상학부모 체크리스트
1152,명탐정 코난 우익논란이 다른 만화들과 붙으면 억울한 이유.jpg
1153,"사람마다 다르게 사용한단는 ""ㅋㅋㅋㅋ큐ㅠㅠㅠ"" 의  ""큐"""
1154,홍김동전 끝나고 나온 어딘가 이상한 뮤비들.jpg
1155,은근 있다는 정리유형..jpg(feat.샤이니 키)
1156,아 이거 웃기다 야구자컨 아이돌자컨 필터봐
1157,성인 남성만 표적으로 노린게 확실한 신림역 사건
1158,나혼산 최근 ㄹㅇ 억까라고 생각했던 논란
1159,에티오피아인 아내가 매일 만드는 것
1160,엘리멘탈 대한민국 역대 애니메이션 흥행 6위 등극
1161,남편이 너무 잘생겨서 결혼하신 분
1162,원작있는 드라마 중에 재밌게 본 드라마는?
1163,어느 강남아파트의 엘리베이터 민원.jpg
1164,PC방에서 놀던 소년들이 어떤 남자를 15분간 따라다님.news
1165,전국 최초 정당 현수막 강제 철거한 인천광역시
1166,폭우로 싹 다 쓸려나가서 가격이 미친듯이 폭등한 야채값 근황
1167,푸바오 독립날 마지막으로 강바오와 함께 했던 시간들
1168,"뉴진스 민지 x투바투 수빈, 휴닝카이 '슈퍼샤이' 챌린지"
1169,고청층 확실한 악귀 시청률 추이
1170,무인 키즈풀 카페서 2살 아이 물에 빠져 숨져
1171,신림동 칼부림 사건) 남자친구 구해주는 여성분.gif
1172,"""왜 개만 먹으면 안돼?"" 식용견과 반려견은 따로 있는가"
1173,방탄 정국 세븐 영국 BBC 공연 직캠 (아파트 주민 ver)
1174,피프티피프티가 전홍준 대표가 유용했다는 20억의 진실
1175,후반부 되면서 시청률 하락세인 드라마 2개
1176,당근마켓 경영위기...  수익 없어 자본잠식 위기
1177,"진상부모 단골멘트 ㅡ교육,의료,학원덬들 몇개나 들어봤어?.jpg"
1178,30대 아재가 쓴 엄마와 나 - 60년대생인 우리엄마 이야기.txt
1179,폴란드에서 전남친이 현남친 죽이고 자살한 사건 일어남
1180,뿌딩이친구들 에둥이 푸덕이 여러분 여기서 바오가족 구분가능?
1181,서양 어리둥절 아저씨 vs 동양 어리둥절 아저씨
1182,나만 알고싶은 모바일 힐링게임
1183,나무에 널어놓은 빨래…아닌 푸바오
1184,다음주 빌보드 Hot 100 싱글차트 최종 예측
1185,건강급식에 “맛 없다” 항의… 학교 영양사들 극단적 선택까지(19년도 기사)
1186,(어리둥절한 외국인 아저씨는 사라졌지만 앞으로도 영원히 우리 마음에 남아있을 거임) 데뷔 후 10년 넘게 만년 조연이다가 서른 넘어 맡은 캐릭터 하나로 대박친 일본 배우.jpg
1187,"스타필드 코엑스몰에 별마당도서관이 없던 시절, 생긴후"
1188,빌보드 HOT100 최종예측
1189,유영진이랑 가장 합이 좋았던 SM 아티스트 골라보기
1190,케이티페리 히트곡으로 알아보는 한국인들 노래 취향 ㅋㅋㅋㅋㅋ.jpg
1191,에스파 넥스트레벨 유영진파트 마치 자기곡 마냥 부르는 바다
1192,현재 뎡배 악귀 카테에서 논란 중인 악귀 찐이름(뭐라고 들리는 지 투표해보자)
1193,[핑계고] 차태현: 형 한화 좀 사 가지고 선수 좀 다 데리고 오면 안돼? ㅋㅋ
1194,한국팬들에게 진짜 반응 좋았던 AKB48의 노래.ytb
1195,서로 뺏기고 뺏는 아이바오 푸바오 🐼🐼
1196,(KBO) 이번 2023년 신인상 후보로 거론되는 선수들
1197,방탄 프로모 비교글이 대놓고 억까글인 이유
1198,엘레베이터가 고장난 고층 아파트
1199,[악귀] 진짜 신들린 것 같은 김태리 오늘자 악귀연기.twt (깜놀 주의)
1200,"푸바오 친할아버지, 친할머니, 외할아버지, 외할머니 얼굴"
1201,현재 샤덬들 사이에서 이슈인 플러팅이다 vs 아니다 (샤이니 자컨)
1202,시원한 풍경의 펭수 pc 배경화면 모음.zip
1203,오늘자 엔시티드림 팬미팅에서 진행된 댄스 챌린지 코너
1204,"한국인이 가장 많이 사망하는 나이…남성 85.6살, 여성 90살"
1205,태연이랑 반신욕도 할 수 있다는 샤이니 키 ㅋㅋㅋㅋ
1206,유럽이 퍼컬이라는 아이브 장원영 마드리드 프리뷰...jpg
1207,발레코어 룩으로 핫게갔던 유투버의 바비코어 룩 영상
1208,뜨는 컨텐츠마다 유튭 인동 상위권 올라간 방탄 정국 Seven
1209,트위터에서 2만 알티 터진 뉴진스 혜인 포카
1210,우리나라에서 가장 긴 에스컬레이터인데 한번도 사고가 나지 않은 이유.jpg
1211,트위터 1만 4천 알티 넘은 일본인 영상 ㅋㅋㅋㅋㅋㅋㅋㅋㅋㅋㅋㅋㅋㅋㅋㅋㅋㅋㅋㅋㅋㅋㅋㅋㅋㅋㅋㅋㅋㅋㅋㅋㅋㅋㅋㅋㅋㅋㅋㅋ.twt
1212,우리나라 인터넷 커뮤니티의 탄생 역사.jpg
1213,[KBO] 오늘자 블루투스 몸맞공.gif
1214,되로주고 말로받는 샤이니 태민 ㅋㅋㅋㅋㅋㅋ
1215,진짜 어질어질한 아동용 애니메이션 줄거리...
1216,뉴진스 앨범에서 국내에 비해 해외픽이라는 노래.ytb
1217,어제 핫게갔던 세븐틴 고척 4층에서 놀던 팬분들 오늘 콘서트 전광판에 잡힘ㅋㅋㅋㅋ
1218,현직 교사의 인스타스토리.jpg
1219,실시간으로 말레이시아 축제를 취소시켜버린 영국 밴드
1220,학교대응 문제 있다 vs 없다 논란중인 대전 초등생 뇌출혈 사건
1221,내가 만약 음바페라면 간다vs안간다
1222,김밥에 절대 빠지면 안되는 재료를 뽑는다면?
1223,양궁 안산 & 김제덕 선수 근황
1224,혐) 모기 알낳는모습 근접촬영
1225,진짜로 특이하게 생긴 (미친과학자 같은) 판다
1226,대박난 뉴진스 글포티/미포티 순위(전곡진입)+영포티
1227,갤럭시폰 + 아이패드 조합에 대한 의견...jpg
1228,모른 척 할테니 다시 컴백 해달라는 요청이 많았던 여솔 데뷔곡 삼대장...jpg
1229,"월 300밑으론 파인 다이닝, 오마카세 금지"
1230,뉴진스 앨범 실물...... jpg
1231,실종 7개월만에 찾은 강아지.twt
1232,녹음실 버전 샤이니 HARD.ytb
1233,교권추락 이슈때 자주보이는 교사 관련글 패턴
1234,한국 교사 연간 수입 6만달러(약 7200만원)로 세계9위
1235,먹고나면 현타오지는 음식 쓰고가자
1236,일본 아이돌 립싱크 발각 레전드
1237,폭우로 삶의터전 날아간 모자에게 무료숙식 제공한 모텔사장.jpg
1238,드디어 뜬 10준수 전신사진.jpg
1239,"신림 칼부림 사건 펨코, 디씨 ^일부^ 반응.jpg"
1240,푸바오 로봇청소기 시절.gif
1241,아라시에서 대중적인 호감도가 제일 높다는 멤버.jpg
1242,수업 첫날 1시간만에 아동기분상해죄로 아동학대 신고당한 23세 교사
1243,전신마비로 수술했던 배정남 반려견 '벨' 근황.gif
1244,반도의 흔한 여자 중학생들 근황.jpg
1245,(MBTI) 다른 유형들이 보면 놀라는 IxFx의 플러팅
1246,권은비 오늘자 워터밤 프리뷰
1247,아기 푸바오가 엄마한테 혼나는 이유
1248,금쪽이 방송 끝나고 올라온 글.twt
1249,만나이 적용되고 나는 어느쪽에 가까운가???
1250,최근 복구되고 있는 더쿠 글.gif 마다 따라다니는 의문의 움짤
1251,소아과 문닫게 만드는 방법도 가지가지
1252,트위터에서 알티 타고 있는 송바오 말 알아듣는 아이바오
1253,하와이에서 구매할 수 있는 산리오 캐릭터즈인형.jpg
1254,일본여행가서 하면 ㅈ되는일
1255,전국에 배송된 독극물 우편물 최초 발송지 밝혀짐.jpg
1256,진짜.. 이유는 명확히 말할 수 없지만 이런 직장인들 존많임
1257,ㄹㅇ한줌시절의  푸바오gif
1258,레딧에서 투표한 '아시아에서 산다고 하면 어디에서 살래?'.jpg
1259,절대 소매치기 안 당하는 가방
1260,"학교서 수업받다 쓰러진 초등생, 뇌출혈로 숨져…학교 대응 논란"
1261,SM 신인남돌 팀명 이거인듯?
1262,잘생김 콜렉터 다운 최근 홍석천 인스타그램에 올라온 남돌 4명.jpg
1263,대리님 대리님 ㅠㅜㅜㅜㅜㅜ 대리니임...... 바쁘시겠져...?
1264,초등교사가 애들 사진 안찍어주는 이유
1265,지금 일주일간 한국에서 일어난 사건
1266,국내 성매매 실태는 얼마나 심각한 수준일까?
1267,"현대자동차, '오송 지하차도 의인' 유병조 씨에게 신형 화물차 지급"
1268,갤럭시 Z플립5 홍보 이미지.jpg
1269,故채수근 상병 영결식에서 눈물바다가 된 해병대원들
1270,"[초점] ""아이폰 안 쓰면 왕따"" 잘파세대 심화…'아재폰' 탈출 나선 삼성 전략은"
1271,동기가 이모티콘 따라써서 기분 나쁨
1272,푸바오 먹방보다 이런 거 찍힘.twt
1273,이젠 봐도 모르는 게 더 많은 의정부고 2023년 졸업사진.jpg
1274,한국에 있는 유일한 수컷 판다🐼
1275,[나혼산] 김대호 아나운서 보고 거울치료 하는 기안84
1276,의욕도 예의도 없는 서바이벌 참가자 때문에 댕빡친 아이키
1277,눈 못 낮추겠다는 30대 미혼남
1278,금쪽이 옆에 착한 애들 억지로 붙여놓는다?
1279,요즘 중딩들 SNS 근황
1280,아들이 팀 마스코트한테 야!라고해서 빡친 야구선수의 꿀밤엔딩..
1281,국내여행 가장 큰 장벽
1282,정체불명소포로 불안해할 덬들을 위한 꿀팁
1283,"'대통령 관저 개입' 백재권 ""尹은 악어, 文은 소…조국은 진돗개"""
1284,김이나가 말해주는 여자 속옷의 비밀 (Feat. 남자들은 잘 모름)
1285,[속보]'대만발 정체불명 소포' 어제 하루만 전국서 987건 신고접수
1286,원피스 | 공식 예고편 | 넷플릭스
1287,"""카드가 없어요"" 당황한 승객에게.. 4212번 버스에서 일어난 일"
1288,호불호 엄청 갈리는 빵
1289,지방 취업보다 서울 백수로...남방한계선 못넘는 청년들
1290,"""나 빼고 다 일본 가"" 진짜였네…올 상반기 日 찾은 외국인 1위 한국인"
1291,덬들은 작가 김은희 작품중에 재밌게 본거 뭐있어?
1292,(대면으로는) 초면인 팬에게 뭔가 달라졌다고 말하는 장원영.twt
1293,"""없어서 못판다""…유통업계, 아사히캔 물량 확보전 '치열'"
1294,아마 아무도 안궁금했고 나만 궁금했을 거 같은 음료수 뚜껑 구조
1295,앰버서더 발탁에 3000만원 목걸이 '품절'..놀라운 '뷔 이펙트'
1296,엄정화 소개팅 이효리 문제의 발언
1297,방탄소년단 정국 BBC One <The One Show> SEVEN 라이브 무대 (공식계정)
1298,조규성 데뷔골.gif
1299,태국 국민이라면 정말 암담할 것 같은 현재 태국의 상황을 알아보자.txt
1300,러바오 레전드영상
1301,정부 “지나친 학생인권조례 재정비”… ‘휴대전화 소지’부터 손볼듯
1302,애인의 10년 짝사랑 상대 vs 5년 만난 전애인
1303,"백인 보수들 결집 중인 ""빌보드 핫 100"" 3위 예측의 인물"
1304,방탄소년단 정국 솔로 싱글 'SEVEN' 영국 오피셜 싱글 차트 3위!!🎊🎉
1305,자기감정 표현 위한 감정단어모음
1306,16년 활동하면서 몸이 힘들어서 처음 울었다는 샤이니 키..twt
1307,일 잘하는 걸로 유명한 방탄소년단 음원정보팀이 만든 것 중에 제일 반응 좋았던 기능
1308,여러분 절대 모르는 아이랑 놀아주지 마세요 폭행으로 고소 당합니다
1309,네이버페이 25원
1310,발사이즈가 반드시 키를 따라가는건 아님.jpg
1311,커플바프 찍은 쥴리엔강-제이제이 커플 (약후)
1312,"[단독] 서울 신림동 대낮 묻지마 살인…""사는 게 어려워 범행"""
1313,실시간 더쿠 공지에서 찐으로 놀란 부분..jpg
1314,넷플릭스 신작 큰 거 온다...
1315,"""숨진 교사 49재에 총파업""…교사들 줄줄이 동참 예고"
1316,친구 남편의 불륜을 내 친구에게 알린다 vs 안 알린다
1317,오늘 공개된 서이초 선생님께서 쓴 손편지
1318,알티타고 있는 아이브 장원영 직찍
1319,고척 4층 맨 뒷자리에서도 잘 즐기는 세븐틴 팬들ㅋㅋㅋㅋㅋ
1320,"학교서 수업받다 쓰러진 초등생, 뇌출혈로 숨져…학교 대응 논란"
1321,뉴진스 음원 총공팀 사과문
1322,"대통령 관저 후보 찾았던 ‘풍수·관상가’, 윤 대통령에 “난세에 필요한 상”"
1323,그지꼴을 하고 와서 아이바오 따라다니는 푸바오
1324,정신건강의학과의사회에서 교사들에 관한 성명 내줌
1325,몬스타엑스 셔누X형원 <Love Me A Little> MV Teaser 1
1326,옆차가 안 끼워줄 때 써보세요....twt
1327,배우 박보영 발 사이즈.jpg
1328,유해 의심 해외소포…국방과학연구소 '위험물질 없다'
1329,"""밝은 목소리 자제 좀""…상상 초월 학부모들"
1330,역대 남성 솔로 곡 스포티파이 위클리 차트 순위.jpg(feat. 방탄 정국 역대 1위)
1331,송바오 눈빛공격하는 아이바오🐼 (판다와쏭)
1332,뉴진스 음원총공팀 공식 입장
1333,복어 5만 마리 방류 . jpg
1334,유튜버 큐영 공지글
1335,"엑소 장수 비결 “멤버들과 친한 게 중요, 싸운 적 한 번도 없어”"
1336,병원 못구해서 대전에서 세종까지 이송된 초등생 사망
1337,8년전 영상이지만 조회수 천백만회에 간증 쏟아지는 소화돕는 요가
1338,실시간 정국 솔로곡 'Seven'이 세계적으로 얼마나 터졌나 실감짤.jpg
1339,기안84 인스타 업뎃 (with 이시언&덱스)
1340,"[단독] 경찰, 천공 아닌 ‘제2의 풍수학자’ 尹 관저 후보 방문 확인"
1341,(역수입) 사회성 없을수록 오히려 하면 안되는 직업
1342,방탄 음원정보팀 사이트 베껴쓴 뉴진스 음원총공팀 + 뒷담 의혹
1343,오송 지하차도 근처 수해복구 하던 근로자 사망..폭염원인 추정
1344,영지랑 같은 오피스텔 사는디 갈비세트 받음
1345,윤석열 장모 법정 구속 장면
1346,당근마켓에 올라온 일제강점기 서대문 형무소 시체처리 사진
1347,임지연 청룡시리즈어워즈 드레스 후보들.jpg
1348,이젠 안바르면 ㅈ되는 썬크림에 관하여
1349,한국이 싫다는 중국 MZ세대들.jpg
1350,심각한 현재 전세계 폭염 상황.jpg
1351,해병대 수색 당시 영상 뜸
1352,"👮🏻‍♂️""할머니, 물 찼어! 업히셔."" 👵🏻""미안혀."""
1353,"속보] 최은순 징역 1년 법정구속... ""죽어버리겠다"" 고함치다 끌려가"
1354,신림역 피의자 키 165cm 30대 무직 남성 “커플인 남성 노려 찔러”
1355,7월 21일 뮤직뱅크 1위
1356,신림역 흉기 난동 가해자가 경찰 오자마자 한 말
1357,아니 할... 할부지????? (푸리둥절)
1358,이거 헌책방에서 산 건데 보세요. 1991년도에 어떤 남학생이 고3 형에게 쓴 편지임. 글씨도 내용도 지금 보니 충격임. 이 정서는 다 어디로 가버렸지
1359,엄청 실수 하는 뮤뱅 엠씨 수습 해주는 뉴진스 혜인
1360,'댄스가수 유랑단' 이효리의 오지랖이 거북했다
1361,[단독] 서울 시내 우체국서 잇따라 정체불명 '노란 소포' 발견 + 기사 추가
1362,영화평론가 박평식 뒷목잡게하는 소식
1363,뉴진스 초동 1일차 110만장 돌파
1364,오늘 판다와쏭 예고
1365,[속보] 윤 대통령 장모 ‘잔고증명 위조’ 항소심서 법정구속
1366,<본인등판> 엑소 디오 도경수  (더쿠 꽤 많이 나옴ㅋ)
1367,학교 체벌 어느날 갑자기 사라진 이유
1368,[오피셜] 김동률 콘서트 개최
1369,"“내 세금으로 월급 받잖아”, “애 낳아본 적 있어?” 이런 말에 젊은 교사 5000명 학교 떠났다"
1370,안산 고잔 이마트 근황 (위험물 의심신고)
1371,몇년전과 비교해서 훨씬 심해진것 같다는 현재 초등학교 분위기 (교사들 증언글)
1372,그 드레스 색깔 논란 최신 근황
1373,팬들사이에서 반응좋은 뉴진스 민지 ETA 뮤비 자동차씬.gif
1374,신림역 범인 전과 17범 아니라고함
1375,펌)초등학생들이 덩치큰 남자선생님들은 무서워한다는것도 옛말인 이유
1376,"얘들아 교수님께 채팅 남길때 ~용, ~욤, ~여 ㅋㅋ ㅠㅠ 이런거 좀 쓰지말자"
1377,영화 ＜바비＞ 얘기 하는 남돌
1378,엘리멘탈 픽사역대 한국흥행 1위 기사 보신듯한 감독님
1379,"'의원 연루설' 맘카페 유포자, 한기호 앞에서 눈물로 선처 호소"
1380,[단독] 웨이브-티빙 합병 추진 막바지...최종 담판만 남아
1381,사과농장에 러시아일꾼 쓴 후기
1382,"담임 폭행 양천구 초등생 부모 ""선생님에 용서 빌고 싶다""…논란 확산에 언론사에 전해와"
1383,혈액을 간장으로 교체한 생선회
1384,"해수부 차관 ""국민들이 미신 믿고 있는 것 같아"""
1385,청룡시리즈어워즈 차은우 이광수 수지 쓰리샷
1386,"""오은영이 학부모들 여럿 망쳤다""…금쪽이 논란 '활활' [이슈+]"
1387,어느 무인텔 후기(반전)
1388,송바오 안아주는 푸바오.gif
1389,조카가 약간 금쪽이 기질이 보였는데 언니가 못지않게 싸가지라 치유된 거 같음 ㅎ
1390,영화 바비 리뷰로 사과문 올린 영화의 전당
1391,[단독] 신림역 인근서 칼부림…피해자 4명 병원으로
1392,"경찰, '교사 극단선택 사건' 서이초 교사 60여명 전원 조사"
1393,"교수 : ""자네, 혹시 결혼했나?"""
1394,왕년에 날리셨다는 95세 할머니
1395,"2312억 떼먹고 숨진 '빌라왕', 배후 없었다…'공소권 없음' 수사 종결"
1396,뉴진스 멜론 탑100 진입 순위
1397,최민수와 살면서 깨달음을 얻은 강주은.jpg
1398,독극물 의심 우편물 생김새.jpg
1399,곽튜브: 정국은 BTS고요
1400,지수 홈마가 찍어준 침착맨.jpg
1401,목동 맘카페에 올라온 어느 신규교사의 글
1402,"[오피셜] 파리 생제르망, 방한 확정"
1403,사족보행 '로봇개' 대통령실 지킨다…용산 입성
1404,블랙핑크 지수 인스타 업뎃
1405,[긴급재난문자] 대전 동구 주산동 테러의심 국제우편물 신고 접수됨
1406,요즘 놀랄정도로 저렴하다는 일본 여행
1407,전세계적으로 노래 시간 짧아진 거 체감되는 뉴진스 컴백 앨범...jpg
1408,형사 : 왜 배 중앙에 中 중 心 심 이라고 문신한거요?
1409,NewJeans (뉴진스) 'ETA' Official MV
1410,배달 리뷰보고 슬퍼진 사장님.....
1411,환경을 위해 스벅 등 카페에 도입된 종이 빨대 근황
1412,"서울 교사들 사이에서 기피지역이라는 강남구, 서초구"
1413,이번에도 엄청 갈린다는 뉴진스 노래픽.jpg
1414,소년원 출신이 교회 다니는거 싫지않음?
1415,영화관 발꼬락 남자 진상 공개
1416,"서영교 ""내 딸은 미혼""…한기호 이어 '서이초 의혹' 일축"
1417,감사의 인사 (주토피아 송바오글)
1418,그거 아세요.. 대학도 개판 오분전 입니다..
1419,교사들 모금해서 교권회복 위한 트럭시위 진행중
1420,한문철TV 무단횡단 사고 (클릭주의).gif
1421,유튜브 구독 안하는 사람들 중에 이런 이유 꽤 있음
1422,"""팁으로 마음 전하세요 ""...카카오 택시에 새로 추가된 신기능"
1423,아이바오와 푸바오의 극명한 행동 차이
1424,모동숲 섬꾸한 뒤 팬들 다시 초대한 NCT 태용
1425,'신이 너와 함께 한다' 로도 보이는 뉴진스 신곡 이름.jpg
1426,어제 뉴스에서 동생바오들 형님 취급받은 푸바오
1427,한국 롤렉스 센터에서 생긴 일.jpg
1428,교장실좀 그만 찾아오세요 학부모님들
1429,푸바오네 인기 있는 이유 중 하나 (feat 혐오의 시대)
1430,푸바오 유튜브 최고 조회수 영상
1431,이상하다고 말 나오는중인 故채수근 상병 빈소 입구에 붙은 영정사진
1432,GFS. 제5호 태풍 '독수리' 29일께 중부지역 관통 예상
1433,어느 자폐아 부모의 글
1434,핫게에 엄마들이 모여 교사 욕하는 커뮤라고 하는 82쿡 실시간 반응(new!!)
1435,제자에 머리채 잡힌 초등교사…학부모 “싫어서 그랬겠지”
1436,학부모들의 이번 교사사망사건 반응
1437,번호 안 알려주는 선생 번호 알아내는 방법
1438,"차태현X조인성, 美 서부 사장님 된다…‘어쩌다사장3’ 출연 확정[공식]"
1439,과거 교권 추락 심각했던 일본 공교육 현황
1440,어제 생일 라방하다 잠든 푸바오🐼의 배
1441,요즘에는 앨범 내면 방송 한번 돌고 끝내잖아
1442,추모 프로필 사진 썼다고 학부모에게 문자받은 초등학교 선생님 근황
1443,담임 선생님 번호 요즘은 비공개인가요??
1444,영화 <바비> 씨네21 별점
1445,[단독] 교통카드 안 찍고 지하철 타는 시대...서울시 ‘태그리스’ 도입
1446,"[단독] 조병규 ""뉴질랜드에서 소송걸어 학폭했다는 누명 벗고 싶다"""
1447,푸바오는 인간 나이로 몇 살쯤 될까
1448,"유튜브 영상, 댓글이나 커뮤에서 본 가장 기억에 남는 '틀린 맞춤법' 적고가세요 📌"
1449,아이돌 팬 사찰했다고 말나왔던 드라마....jpg
1450,"tvn 알쓸시리즈 새롭게 시작하는 ""알쓸별잡"" 출연진"
1451,서이초로 몰린 전국 교사님들.gif
1452,[제2회 BSA 심사평] 송혜교vs'더 글로리'→박지훈·임지연 몰표의 주인공
1453,롤링스톤에서 선정한 최고의 케이팝 100
1454,여러분이 중학생때 나온 소녀시대 노래.twt
1455,시청자들과 신들린 드립이 오가는 개웃긴 주우재 라방 근황.jpg
